### ISSUE TITLE
SNMP cross talk - UDP traffic appears to be mixed up between devices

### ISSUE THREAD

**Issue by Infiniverse** [soniah/gosnmp#217]
We are using gosnmp in a multi-threaded application to monitor many devices.

Every now and then we get SNMP results incorrectly attributed to the wrong host.

Talk a look here at the tcpdump. The SNMP request  from 10.18.1.27 (SNMPv1) overlaps with one from 10.18.1.5 (SNMPv2).

    07:40:49.751995 IP 10.18.0.48.57573 > 10.18.1.27.snmp:  GetRequest(78)  33.1.2.3.0 33.1.1.1.0 33.1.1.2.0 33.1.2.2.0
    07:40:49.752031 IP 10.18.0.48.24707 > 10.18.1.5.snmp:  GetRequest(78)  33.1.2.3.0 33.1.1.1.0 33.1.1.2.0 33.1.2.2.0
    07:40:49.753924 IP 10.18.1.27.snmp > 10.18.0.48.57573:  GetResponse(78)  noAccess@1 33.1.2.3.0= 33.1.1.1.0= 33.1.1.2.0= 33.1.2.2.0=
    07:40:49.754660 IP 10.18.1.5.snmp > 10.18.0.48.24707:  GetResponse(104)  33.1.2.3.0=1406 33.1.1.1.0="Vertiv" 33.1.1.2.0="GXT5-5000IRT5UXLE" 33.1.2.2.0=0
    07:40:59.771176 IP 10.18.0.48.54738 > 10.18.1.5.snmp:  GetRequest(78)  33.1.2.3.0 33.1.1.1.0 33.1.1.2.0 33.1.2.2.0
    07:40:59.773658 IP 10.18.1.5.snmp > 10.18.0.48.54738:  GetResponse(104)  33.1.2.3.0=1406 33.1.1.1.0="Vertiv" 33.1.1.2.0="GXT5-5000IRT5UXLE" 33.1.2.2.0=0

This is the monitor outputt. You can see that the results are getting mixed up. (one device is an SNMP 1 device and the other is SNMP2)
 
    10.18.1.5 OK 07:40:57 | [ 1/12 ] SecondsOnBattery: 0, Estimated Battery Minutes: 1404, Manufacturer: Vertiv, Model: GXT5-5000IRT5UXLE
    10.18.1.5 CRITICAL 07:40:43 | [ 1/12 ] SNMP error: NoAccess
    10.18.1.5 OK 07:39:18 | [ 1/12 ] SecondsOnBattery: 0, Estimated Battery Minutes: 1405, Manufacturer: Vertiv, Model: GXT5-5000IRT5UXLE

And similarly for the other device:

    10.18.1.27 CRITICAL 08:11:20 | [ 1/12 ] SNMP error: NoAccess
    10.18.1.27 OK 08:11:16 | [ 1/12 ] SecondsOnBattery: 0, Estimated Battery Minutes: 1406, Manufacturer: Vertiv, Model: GXT5-5000IRT5UXLE

Is this because of a thread-safeness in the gosnmp module?

**Comment by Infiniverse** [comment]
Ok - looks like it was a threading problem in our code. Sorry for the noise!
